Category,Message,word_count,char_count
0,hi juan im coming home fri hey course expect welcome party lot present ill phone u get back load love nicky x x x x x x x x x,39,159
0,gumbys special ltgt cheese pizza dollarnumber know doin tonight,19,95
1,link picture sent also use,13,96
0,like personal sized,6,29
0,im great aunt anniversary party tarpon spring,11,63
0,cab availablethey pick drop door step,10,53
0,oktake careumma,5,34
0,unlimited text limited minute,4,33
1,double min number txts orange tariff latest motorola sonyericsson nokia bluetooth free call mobileupdnumber number callnumberoptouthfnumber,22,151
0,problem spending lot quality time together,12,65
1,urgent numbernd attempt contact u poundnumber prize yesterday still awaiting collection claim call number aclnumberpm,24,150
0,heard week,6,30
1,dear dave final notice collect number tenerife holiday number cash award call number landline tc sae boxnumber cwnumberwx numberppm,26,153
0,yes last practice,3,19
1,tell u number call number claim poundnumber prize u number enter ur mobile personal detail prompt careful,23,120
0,thank youve wonderful,6,36
0,mean confirmed tot juz say oni ok,12,61
0,depends would like treated,10,50
0,right brah see later,6,28
0,waiting e car number mum lor u leh reach home already,13,57
1,number account numberxxxxxxxxx show number unredeemed point claim call number identifier code xxxxx expires numbernumbernumber,18,128
1,want new video handset number anytime network min half price line rental camcorder reply call number delivery tomorrow,24,145
0,went fast asleep deartake care,5,32
0,mean fat head,9,38
0,sound like plan cardiff still still cold im sitting radiator,16,86
0,serious like proper tongued,6,37
0,shes good wondering wont say hi shes smiling coping long distance,23,116
0,noe shes da car later c lar im wearing short,15,77
0,yeah whatever lol,3,17
0,ard number lor ok message lor,9,37
0,ok c u,4,13
0,eh ur laptop got stock lei say mon muz come take look c got,21,88
0,need ke qi bored izzit suddenly thk,14,63
0,wish dont think gon na snow much flurry usually get melt hit ground eek havent snow since ltgt even born,40,205
1,freeringtone reply real poly eg realnumber number pushbutton number dontcha number babygoodbye number golddigger number webeburnin numberst tone free number u join poundnumberwk,28,157
0,oh really perform write paper go movie home midnight huh,16,78
0,okay lor still let u go ah coz know later drop card box right,26,121
0,izzit still raining,4,25
0,wasnt enough trouble sleeping,8,46
0,havent add yet right,6,26
0,lol really need remember eat im drinking appreciate keeping company night babe smile,24,126
0,babe lost try rebooting,11,46
0,yes nigh cant aha,5,23
0,thk got ta go home urself co ill b going shopping number frens present,18,82
0,nooooooo im gon na bored death day cable internet outage,13,72
0,so amount get pls,7,30
0,playin space poker u,4,22
0,come guoyang go n tell u told,11,48
0,need get,6,24
0,r giving second chance rahul dengra,9,46
0,yeah fact asked needed anything like hour ago much,18,86
0,first strike red one bird antelope begin toplay fieldof selfindependence believe flower contention growrandom,27,158
0,wan go c doctor,8,30
0,daddy bb,6,25
1,free msg get gnarl barkley crazy ringtone totally free reply go message right,17,100
0,shes borderline yeah whatever,5,35
0,number lor ya go number dinner together,9,48
0,gentle princess make sweet gentle love,11,60
0,u doin baby girl hope u okay every time call ure phone miss u get touch,24,97
0,sorry went bed early nightnight,6,36
0,like think there always possibility pub later,14,71
0,hmm yeah grooved im looking forward pound special,17,83
0,got video tape pple type message lor u free wan number help hee co noe u wan number watch infernal affair ask u along asking shuhui oso,34,153
0,hi dude hw r u da realy mising u today,10,38
0,hungry buy food good lei mum n yun dun wan juz buy little bit,18,81
1,refused loan secured unsecured cant get credit call free number number number text back help,22,114
0,probably wont eat today think im gon na pop weekend u miss,20,94
0,knew u slept v late yest wake late,12,52
0,haha dont angry take practice real thing,16,83
0,one day training,6,33
0,could kiss feel next,10,42
0,nice day dear,6,24
0,sent lanre fakeyes eckankar detail mail box,10,54
0,dad back ph,6,23
1,specially selected receive number award call number line close cost numberppm number tc apply ag promo,23,137
0,ask say please message,10,45
0,e timing go w u lor,10,37
0,callin say hi take care bruv,10,44
1,valued vodafone customer computer picked win poundnumber prize collect easy call number,25,134
0,u turn heater heater set ltgt degree,15,73
0,thanks message really appreciate sacrifice im sure process direct pay find way back test tomorrow im class wonderful day,39,202
0,thats trouble class go well youre due dodgey one expecting mine tomo see recovery time place,26,137
1,free video camera phone half price line rental number mths number cross ntwk min number txts call mobileupdnumber number callnumberoptoutnumber,24,146
0,wot u number j,5,13
0,night night see tomorrow,5,29
0,roger probably going rem number,10,51
0,u think girl propose u today seing ur bloody funky shit fucking faceasssssholeeee,18,132
0,wish u feel alone,9,35
0,reason team budget available last buy unsold player base rate,19,96
0,ceri u rebel sweet dreamz little buddy c ya numbermoro need bloke,14,73
1,ringtoneking number,2,18
0,huh cant thk oredi many page,13,55
0,frens go lor alone wif mum n si lor,15,60
0,nationwide auto centre something like newport road liked,14,83
0,hey missed tm last night phone charge smile meeting friend shortly,24,111
0,whatever juliana whatever want,6,40
1,ringtone club grnumber new polys direct mobile every week,12,63
0,hello sort town already dont rush home eating nacho let know eta,22,104
0,ok lor anyway thk cant get ticket co like quite late already u wan number go look number ur frens darren wif,30,133
1,bank granite issue strongbuy explosive pick member numberpercentage nasdaq symbol cdgt dollarnumbernumber per,22,137
0,dizzamn aight ill ask suitemates get back,10,53
0,nimbomsons yep phone know one obviously co thats real word,12,70
0,love cuddle want hold strong arm right,15,67
0,r u continent,5,22
0,well pay like ltgt yr difficult,12,63
1,bored housewife chat n date numbernumbernumber btnational rate numberpmin landline,13,95
1,tried call reply sm video mobile number min unlimited text free camcorder reply call number del thurs,28,143
0,kkwhen give treat,5,33
1,numbernd time tried contact u u poundnumber prize number claim easy call number numberp per minute btnationalrate,30,158
0,he gon na worry nothing wont give money use,15,74
0,get gift year didnt get anything bad,13,60
0,well there pattern emerging friend telling drive come smoke telling im weed fiendmake smoke muchimpede thing see im hesitant,41,220
0,ow u deyi paid numbernumberthousadi told u would call,11,54
0,im fine babe aint number much tho saw scary movie yest quite funny want numbermrw afternoon town mall sumthinxx,25,127
0,im reaching home number min,6,27
0,forgot working today wan na chat thing ok drop text youre free bored etc ill ring hope well nose essay xx,34,162
0,ha must walk everywhere take tram cousin said walk vic market hotel,21,111
0,discussed mother ah,5,30
0,sorry cant text amp drive coherently see twenty,11,61
1,receiving week triple echo ringtone shortly enjoy,12,73
0,place get room cheap,8,39
0,eek thats lot time especially since american pie like number minute long cant stop singing,20,103
0,gran onlyfound afew day agocusoon honi,7,44
1,uve selected stay number number top british hotel nothing holiday valued poundnumber dial number claim national rate call bxnumber swnumberss,29,158
0,university southern california,4,34
0,pick rayan macleran,7,37
0,u gd lor go shopping got stuff u wan number watch infernal affair come lar,20,89
0,well ball time make call,6,31
0,wat time wan today,5,21
0,ltgt mca conform,6,35
0,oh ok wats ur email,5,23
0,yes princess going make moan,9,45
0,lol ok didnt remember til last nite,9,42
0,anyway many good evening u,8,38
0,cool ill text,7,28
0,sorry vikky im watching olave mandara movie kano trishul theatre wit frnds,14,84
0,im happy babe woo hoo party dude,12,52
0,taking italian food pretty dress panty,16,78
0,wot u number thout u gon na call txt bak luv k,14,54
1,chosen receive poundnumber award pls call claim number number collect award selected receive valued mobile customer,28,158
0,holding,5,23
0,dont flatter tell man mine two pint carlin ten minute please,16,92
0,hope scared,5,24
0,im home n ready,5,22
0,time u get,6,23
0,literally bed like ltgt hour,13,65
0,yes reg ciao,5,21
0,mean website yes,6,29
1,win poundnumber cash prize prize worth poundnumber,10,45
1,thanks ringtone order reference number xnumberyour mobile charged numbernumber tone arrive please call customer service number,23,156
0,lol could starve lose pound end day,16,66
0,yeah thats impression got,6,32
0,ok ok take care understand,7,34
0,motivate behind every darkness shining light waiting find behind every best friend always trust love bslvyl,26,153
0,ya ok dinner,5,23
0,slept timeyou,6,32
0,dont make ne plan nxt wknd coz want u come ok,16,69
0,school starting stay whats weather like food social support system like friend school thing important,32,180
0,ha ha nan yalrigu heltiniiyo kothi chikku u shared many thing wit meso far didnt told body even uttered word abt u ur trusting much tell others plz nxt time dont use word meok chikkub,49,255
0,noice text youre,6,31
0,hi di yijue meeting number pm esaplanade tonight,12,59
1,moby pub quizwin poundnumber high street prize u know new duchess cornwall txt first name numberunsub stop poundnumbernumber number sp,29,154
1,week savamob member offer accessible call number detail savamob pobox number lanumber numberwu poundnumbernumberweek savamob offer mobile,24,158
0,aight ive set free think could text blake address occurs im quite sure im thought,29,138
0,hi dear saw dear happy battery low,15,67
0,age hows abj,8,37
0,prof passed paper sem congrats student enna kalaachutaarama prof gud mrng,22,122
0,dont kick coco he,6,29
0,fyi im gon na call sporadically starting like ltgt bc doin shit,18,97
1,contacted dating service someone know find call mobile landline number poboxnumberldnsnumber,26,148
1,tbspersolvo chasing u since sept forpoundnumber definitely paying thanks information ignore kath manchester,21,140
0,hope youre much fun without see u tomorrow love jess x,15,75
0,ok wont call disturb one know avoiding burden,20,84
0,ive reached home n bathe liao u call,12,56
1,loan purpose even bad credit tenant welcome call noworriesloanscom number,16,106
0,actual exam harder nbme,7,36
0,lot sickness thing going round take easy hope u feel better soon lol,17,84
1,number kick new season numberwks free goal news ur mobile txt ur club name number eg villa number,25,114
0,hey sathya till dint meet even single time saw situation sathya,20,96
0,gam gone outstanding inning,5,35
0,played smash bros ltgt religiously,7,46
0,sir good morning hope good weekend called let know able raise ltgt dad however said would make rest available mid feb amount still quite short hoping would help good day abiola,56,276
0,hurry home soup done,5,25
0,good afternoon love good see word ym get tm smart move slave smile drink coffee await,32,153
0,quite ok bit ex u better go eat smth else ill feel guilty,16,74
1,orange brings ringtones time chart hero free hit week go ringtones pic wap stop receiving tip reply stop,29,154
0,lem know youre,5,27
1,private number account statement number show number unredeemed point call number identifier code number expires numbernumbernumber,21,148
0,need stop going bed make fucking dealing,13,63
0,love brother time talk english grin say hey muhommad penny say hello across sea,31,147
1,tried call reply sm video mobile number min unlimited text free camcorder reply call number,27,135
0,hey doc pls want get nice shirt hubby nice fiting one budget ltgt k help pls load card abi hwkeep posted luv number mj,35,154
0,remain unconvinced isnt elaborate test willpower,12,70
0,life nothing wen v get everything life everything wen v miss something real value people wil realized absence gud mrng,29,157
0,miss,6,24
0,aint answerin phone actually pretty reasonable hour im sleepy,16,85
0,hey rite u put number evey mnth,13,48
0,going bed prin,7,26
0,think thanks see tomo,9,46
0,u dun drive go number sch,10,35
0,home lei,6,24
1,gsoh good spam ladiesu could b male gigolo number join uk fastest growing men club reply oncall mjzgroup numbernumberstop reply stop emailaddr,26,166
0,u hav frnd name ashwini ur college,11,48
0,jus finish lunch way home lor tot u dun wan number stay sch today,19,80
0,k numbermarrow coming class,8,39
1,hot live fantasy call number numberp per min ntt ltd po box number croydon crnumber numberwb number national rate call,24,122
0,pls send address sir,6,29
0,want lick pussy,7,32
0,yo gon na still stock tomorrowtoday im trying get dubsack,14,75
1,urgent mobile number awarded number prize guaranteed call number landline claim number valid numberhrs numberppm,21,141
0,ill see prolly yeah,5,25
0,thought could go dinner ill treat seem ok,12,60
0,stand away doesnt heart ache without dont wonder dont crave,37,154
0,sorry never hear unless book one kinda jokethet really looking skinny white girl one lineyou much camera something like theyre casting look,42,230
0,sure thing big man hockey election number shouldnt go longer hour though,18,92
0,watch lor saw swatch one thk quite ok ard number need numbernd opinion leh,20,87
0,hiya u like hlday pic looked horrible took mo hows camp amrca thing speak soon serena,23,116
0,babe go day miss already love loving kiss hope everything go well,28,126
0,yunny im goin late,6,28
0,doc prescribed morphine cause pain med arent enough waiting mom bring med kick fast im gon na try later,32,160
0,cool want go kappa meet outside mu,14,60
0,hey sexy bun told adore loverboy hope remember thank sister law meatball grin love babe,32,153
0,may b approve panalambut post,9,55
1,spjanuary male sale hot gay chat cheaper call number national rate numbernumberpmin cheap numbernumberpmin peak stop text call number numberpmin,24,157
0,im workin get job,8,36
0,youre done mean,8,34
0,ur luck love someone ur fortune love one love u miracle love person cant love anyone except u gud nyt,32,153
0,hi baby ive got back work wanting see u allday hope didnt piss u phone today u give call xxx,36,147
1,freemsg today day ready im horny live town love sex fun game netcollex ltd numberp per msg reply stop end,30,152
0,yahoo boy bring perf legal,12,55
0,need say anything know outsider,13,54
0,ever one foot,7,34
0,got ltgt,4,22
0,good dont need receiptswell done yes please tell whats number could ring,19,103
0,leave wif lar wan carry meh heavy da num number familiar,19,87
0,beautiful truth expression face could seen everyone depression heart could understood loved one gud ninumber,27,153
0,infact happy new year seeing,14,67
1,simpson movie released july number name band died start film agreen day bblue day cred day send b c,30,146
0,thats shame maybe cld meet hr tomo,10,48
0,lol would despite cramp like girl,12,57
0,cant wait cornwall hope tonight isnt bad well rock night shite anyway im going kip good night speak soon,32,157
0,pls help tell sura im expecting battery hont pls send message download movie thanks,27,139
1,please call amanda regard renewing upgrading current tmobile handset free charge offer end today tel number number number subject t c,28,160
0,havent found way get another app phone eh go net cafe take job geeee need babe crave see,37,158
0,work mon thurs sat cant leh booked liao day u free,19,90
0,comin fetch u oredi,6,28
0,whats nanny address,3,22
0,haf u eaten wat time u wan number come,10,38
1,want new video phone number anytime network min half price line rental free text number month reply call number free delivery,26,144
0,yo call get chance friend mine wanted ask big order,21,92
0,single single answer fighting plus said broke didnt reply,16,84
0,certainly put thing perspective something like happens,11,74
0,got tv number watch meh u work today,10,40
0,felt sonot conveying reason ese,11,63
0,hows going got exciting karaoke type activity planned im debating whether play football eve feeling lazy though,21,134
0,told coming wednesday,7,35
0,ok called mom instead fun,7,35
1,dear voucher holder claim week offer pc please go tscs apply,17,112
0,well im desperate ill call armand,10,54
0,work right,7,27
0,havent heard anything he answering text im guessing flaked said jb fantastic,20,111
0,mmmmmm love youso much ahmad cant wait year begin every second take closer side happy new year love,32,157
0,pls whats full name joke school co fee university florida seem actually ltgt k pls holla back,23,124
0,ok said ive got wisdom teeth hidden inside n mayb need number remove,15,77
0,pls pls drink plenty plenty water,7,37
0,hows queen going royal wedding,14,71
0,he lag thats sad part keep touch thanks skype,16,74
0,ok lor go tog lor,7,28
0,two team waiting player,6,34
0,send copy da report,9,34
0,swhrt u deyhope ur ok tot u numberdaylove n misstake care,13,67
0,ok da already planned wil pick,9,41
1,urgent please call number abta complimentary number spanish holiday poundnumbernumber cash await collection sae tc box number ponumber numberez numberppm number,23,143
0,really need shit tomorrow know wont awake like number,17,83
0,im good registered vote,7,38
0,hmm ok ill stay like hour co eye really sore,14,61
0,dear got bus directly calicut,6,32
0,mm umma ask vava also come tell play later together,13,62
0,well general price ltgt oz let know ifwhenhow much want,14,79
0,moment dayhas valuemorning brings hopeafternoon brings faithevening brings luvnight brings restwish u find todaygood morning,22,158
0,ltgt w jetton ave forgot,7,37
0,ok im coming home,5,23
0,use foreign stamp country,8,43
0,sorry lot friendofafriend stuff im talk actual guy want buy,21,108
1,cmon babe make horny turn txt fantasy babe im hot sticky need reply cost poundnumbernumber number cancel send stop,30,147
0,wylie update weed dealer carlos went freedom class lunsford,15,81
0,happy baby alright take job hope fine send kiss make smile across sea kiss kiss,35,154
0,c movie juz last minute decision mah juz watch number lar tot interested,18,84
0,enjoying semester take care brother,9,54
1,important information number orange user numberxxxxxx today ur lucky daynumber find log onto there fantastic prizeawaiting,22,157
0,get door im,5,22
0,let use next week princess,7,34
0,go home first lar wait number lor put stuff first,17,68
0,want kfc tuesday buy number meal number gravy number mark number,17,74
0,dahe stupid daalways sending like thisdon believe messagepandy mental,16,102
0,oi gon na ring,5,22
1,missed call alert number called left message number,11,72
0,attended nothing,6,32
0,ard number like dat lor juz meet mrt station dun haf come,18,76
0,dear sleeping p,6,26
0,er mw im filled tuth aight,7,29
0,office around number pm going hospital,11,52
0,actually im waiting number week start putting ad,11,60
0,anything lor go go lor,10,44
0,u free sat rite u wan number watch infernal affair wif n darren n mayb xy,18,77
0,yo around friend mine lookin pick later tonight,13,65
0,stupid auto correct phone,6,31
0,double eviction week spiral michael good riddance,13,73
0,world suffers lot violence bad people silence good people gud night,23,127
0,ok thats cool either raglan rd edward rd behind cricket ground gim ring ur closeby see tuesday,25,131
0,buy one egg daplease,6,31
0,started skye,5,24
0,bookedthe hut also time way,15,71
0,several sir,5,23
0,u really pig leh sleep much dad wake number smth number eat lunch today,19,79
0,love hope anything drastic dont dare sell pc phone,20,97
1,freemsg record indicate may entitled number pound accident claim free reply yes msg opt text stop,31,157
0,life style garment account please,6,38
0,lol wtf random btw lunch break,9,44
0,sez hows u de arab boy hope u r good give love number evrynumber love ya eshxxxxxxxxxxx,20,88
0,lay man let know missed thought great day send bimbo ugos number ill appreciate safe,32,155
0,detroit home snow enjoy,7,36
1,show ur colour euro number numbernumbernumber offer get england flag numberlions tone ur phone click following service message info,25,135
0,aight im chillin friend room text youre way,15,71
0,toshiba portege mnumber gd,5,27
0,well welp sort semiobscure internet thing,9,49
1,text pas number collect polyphonic ringtones normal gprs charge apply enjoy tone,17,105
1,accordingly repeat text word ok mobile phone send,14,74
0,loosu go hospital de dont let careless,9,46
0,much eighth,5,23
0,omg joanna freaking shes looked thru friend find photo shes asking stuff myspace havent even logged like year,37,183
0,send ur birthdate month year tel u ur life partner name method calculation reply must,22,118
0,juz havent woke bit blur blur dad went liao cant cum oso,20,92
0,clothes jewelry trip,6,38
1,block breaker come deluxe format new feature great graphic tmobile buy poundnumber replying get bbdeluxe take challenge,27,156
0,aah cuddle would lush id need lot tea soup kind fumbling,18,87
1,important information number orange user today lucky daynumberfind log onto there fantastic surprise awaiting,22,152
0,plan family set stone,10,45
0,pls dont forget study,5,24
0,youll never believe actually got taunton wow,13,69
0,den weekday got special price haiz cant eat liao cut nail oso muz wait finish drivin wat lunch still muz eat wat,25,140
0,broke list reason nobody town cant tell shes sarcastic faggy,23,114
0,ltdecimalgt common car better buy china asia find less expensive ill holla,27,131
0,greatest test courage earth bear defeat without losing heartgn tc,15,85
0,sorry im stil fucked last nite went tobed number got number work number,17,75
0,hey whats plan sat,7,31
0,beauty sleep help ur pimple,7,37
0,great hope using connection mode men also co never know old friend lead today,24,122
1,natalja numberf inviting friend reply yesnumber nonumber see stop send stop frnd number,22,136
0,get,4,19
0,kind missed train co asthma attack nxt one half hr driving sure park,22,106
0,ball moving lotwill spin last difficult bat,13,67
0,haiyoh maybe hamster jealous million,8,51
0,please send aunty number,8,40
0,im glad following dream,7,40
0,ive reached home finally,4,28
1,urgent important information number user today lucky day number find log onto fantastic surprise awaiting,27,163
0,wn u r hurt prsn close number u fight wit dem coz somtimes dis fight save relation bt quiet leaf nothin relation gud eveb,33,152
0,u call,4,17
0,science tell chocolate melt sunlight please dont walk sunlight bcozi dont want loss sweet friend,23,138
0,yes come nyc audiitions trying relocate,12,60
0,pocked,6,28
0,congrats thats great wanted tell tell score co might make relax motivating thanks sharing,28,142
0,wud never mind u dont miss u dont need u wil really hurt wen u need amp u dont tell take care,32,139
0,hey mr whats name bill brison book one language word,16,79
0,okay good problem thanx,6,34
0,information ikea spelled cap yelling thought left sitting bed among mess came said going got home class please dont try bullshit make want listen less,59,290
0,call ure done,5,25
0,gwr,1,5
0,best watch say cause get drunk motherfucker,13,63
1,kit strip billed numberp netcollex ltd po box number ignumber oja,15,74
1,please call number immediately urgent message waiting,13,81
1,thesmszonecom let send free anonymous masked messagesim sending message theredo see potential abuse,20,138
0,erm woodland avenue somewhere get parish magazine telephone number,17,104
0,ta job available let know please co really need start working,16,82
0,aiyar hard number type u later free tell call n scold n tell u,18,74
0,yup im free,3,15
0,good good billy mate gone jogging enjoy concert,13,77
0,yo come carlos soon,8,37
0,sweet think something nice time tonight ill probably txt u later co im lonely xxx,28,129
0,guess useless calling u number something important,10,54
0,ha ha popped loo helloed hello,14,63
0,dint tell anything angry told abi,15,66
0,happens r numberwaxsto wat want come ill get medical insurance shell able deliver basic care im currently shopping right medical insurance give til friday morning thats ill see major person guide right insurance,62,329
0,keep ten r shelf buy two egg,10,40
0,wasnt well babe swollen gland throat end,19,86
0,ur change number da report big co ive already made change number da previous report,16,82
0,captain room,5,24
0,cant speak bcaz mobile problem listen cannt listen voice call later,22,111
0,hiya stu wot u numberim much truble home moment evone hate even u wot hell av done wont u tell text bck please luv dan,37,155
0,si take mokka player,6,36
0,still playing gautham,6,35
0,hey mr going sea view couple gay mean game give bell ya finish,26,111
0,k jason say he gon na around ill around ltgt,14,72
0,sorry able get see morning,15,61
0,aight well keep informed,5,27
0,searching good dual sim mobile pa,9,46
0,seems unnecessarily hostile,4,32
0,dude got haircut breezy,9,43
1,congrats number mobile numberg videophones r call number videochat wid ur mate play java game dload polyh music noline rentl bxnumber ipnumber numberwe numberpm,26,161
0,numberappledayno doctor numbertulsi leafdayno cancer numberlemondayno fat numbercup milkdayno bone problms number litre watrdayno disease snd th number u care,21,154
0,thought king hill thing,12,55
0,nope ill come online,5,27
0,also tell said happy birthday,7,35
0,bishan lei tot say lavender,8,37
0,boo time u get u supposed take shopping today,15,70
0,u sound like manky scouse boy stevelike travelling da bus homewot u inmind number recreation dis eve,22,115
0,fyi im taking quick shower epsilon like ltgt min,13,68
0,tuesday night r u number real,8,29
0,yes appt,6,27
0,got outta class gon na go gym,7,34
