Category,Message,word_count,char_count
0,true passable get high score apply phd get numberyears salary make life easier,25,119
1,number nokia tone number ur mob every week txt nok number numberst tone free get txtin tell ur friend numberptone number reply hl numberinfo,31,143
0,prakesh know,4,22
0,teach apps da come college,9,43
0,rofl betta invest anti aging product,8,46
0,sir receive account another numberhr time sorry delay,14,75
1,reply name address receive post week completely free accommodation various global location phnumberp,23,159
0,youll submitting da project tmr rite,8,42
1,free entry poundnumber weekly comp send word enter number number tc cust care number,21,122
0,jus an lar ull noe later,7,31
0,want send something sell fast ltgt k easy money,15,76
0,got thing may pub later,13,51
0,number finish meeting call,5,27
0,lol ok ill snatch purse,7,34
0,emailaddr edrunk sorry iff pthis make senrddnot dancce number drum n basqihave fun numbernhite x ro xxxxxxx,21,125
0,much getting,5,24
0,ur paper e morn aft tmr,9,33
0,dear relieved westonzoyland going plan end,11,63
0,hope great new semester wish best made greatness,19,96
0,oh yes speak txt number u hmm u get email,14,53
0,want show world princess europe,12,59
0,nobody decide eat dad want chinese,10,52
0,shoot im doc waiting room,10,45
0,im going number dinner soon,7,34
0,hello site download song urgent pls,10,53
0,know u mean king havin credit im goinnumberbed night night sweet onlynumbermore sleep,21,110
0,horrible gal sch stuff come u got mc,13,60
0,hi hun im comin numbernitetell everynumber im sorry number hope u ava goodtimeoli rang melnite ifink mite b sortedbut il explain everythin monlnumberrsx,27,152
1,please call number immediately urgent message waiting,13,81
0,yeah like go like friend imma flip shit like half hour,20,87
0,mum say wan go go shun bian watch da glass exhibition,17,83
0,plan pongal,5,26
0,wait till end march el nino get oh,12,58
0,yet chikkugoing room nw im bus,9,46
0,also cbe pay,10,43
0,honey boo im missing u,5,24
0,sent jd customer service cum account executive ur mail id detail contact u,18,97
0,yo im parent gettin cash good news picked downstem,14,70
0,thank much skyped wit kz sura didnt get pleasure company hope good weve given ultimatum oh countin aburo enjoy,35,179
1,hungry gay guy feeling hungry number call number numberpmin stop text call number numberpmin,20,120
0,ok wahala remember friend need,11,54
0,see half hour,7,26
0,im inperialmusic listeningnumberthe weirdest track ever byleafcutter johnsounds like insect molestedsomeone plumbingremixed evil men acid,19,154
0,hey sorry didntgive ya bellearlier hunnyjust bedbut mite go number thepub lnumbertr uwana mt uploads luv jenxxx,24,123
0,seriously tell exact word right,8,48
1,u get number phone wan na chat number set meet call number u cum numbermoro luv jane xx callspoundnumberminmoremobsemspoboxnumberponumberwa,27,146
0,tee hee lecture cheery bye bye,8,40
0,sorry chikku cell got problem thts nt able reply u msg u,19,81
0,still havent collected dough pls let know go place sent get control number,26,116
0,ok,1,5
1,network operator service free c visit numberbiz,12,66
0,let know contact ive settled room let know ok,18,81
0,wot u number u weirdo,6,20
0,lor,3,13
0,dont put phone silent mode ok,8,37
0,meet number number depends wan number lor,17,64
0,waiting number tv show number start lor u leh still busy ur report,15,69
0,oh ho first time u use type word,13,55
0,one doesnt stalk profile,9,45
0,ever green quote ever told jerry cartoon person irritates u always one love u vry much fails express gud nyt,32,159
0,yes thought thanks,5,25
0,shes drinkin im ok,6,28
0,wondering others took,7,40
0,night ended another day morning come special way may smile like sunny ray leaf worry blue blue bay gud mrng,31,156
0,dog must always wait till end day word run time cell already,33,138
0,happy new year u,6,24
0,heygreat dealfarm tour numberam numberpm dollarnumberpax dollarnumber deposit number may,12,70
0,eat jap done oso aft ur lect wat got lect number rite,14,60
0,hey babe saw came online second disappeared happened,17,86
0,da birthdate certificate april real date today dont publish shall give special treat keep secret way thanks wish,35,174
0,happy birthday may ur dream come true,8,48
0,aiyah u ok already lar e nydc wheellock,10,48
0,tell said eat shit,6,25
0,sure driving reach destination soon,10,54
0,k much numberth fifty,10,38
0,daily text favour time,10,44
0,great hear settling well whats happenin wit ola,12,64
0,cocksucker make feel better ipads worthless garbage novelty item feel bad even wanting one,23,133
0,tot u reach liao said tshirt,8,36
0,fran decided number go n e way im completely broke knackered got bout number c u numbermrw love janx p dad fone credit,31,132
0,right ill make appointment right,8,48
0,designation software developer may get chennai,10,62
1,enjoy jamster videosound gold club credit number new videosoundsnumber logosmusicnews get fun jamstercouk numberonly help call number,23,162
1,get number lion england tone reply lionm number mono lionp number poly number go number original n best tone numbergbp network operator rate apply,28,155
0,jokin oni lar busy wun disturb,11,46
0,ok careful dont text drive,9,39
0,ill always even spirit ill get bb soon trying sure need,23,103
0,u r much close heart u go away shattered plz stay,20,83
0,love u number babe r u sure everything alrite idiot txt bak girlie,19,84
0,abt making pic bigger,8,39
0,got got number colour lor one colour quite light n e darker lor actually im done shes styling hair,25,122
0,whenevr ur sad whenevr ur gray remembr im number listn number watevr u wan na say jus walk wid little whileamp promise ill bring back ur smile,30,154
0,nothing ok anyway give treat,7,36
1,win newest harry potter order phoenix book number reply harry answer number question chance first among reader,26,138
0,correct work today,6,30
0,sent scream moan bed princess,11,57
0,wake long ago already dunno thing,10,54
0,oh getting even u u,7,34
0,thk number shd ok said plus minus number leave line paragraph,19,84
0,call plz number show coveragd area urgnt call vasai amp reach numbero clock call plz,29,139
0,yeah jay sort fucking retard,7,35
0,sorry bathroom sup,6,31
1,ur balance poundnumber ur next question sang uptown girl number number answer txt ur answer number good luck,26,125
0,exam february number wish great day,11,48
0,dont know come ask question like dont mistake,21,94
0,aight rush ill ask jay,6,27
0,good morning plz call sir,6,28
0,ok lar u sleep early nite,8,41
0,oh icic k lor den meet day,8,42
0,oh half hour much longer syria canada eh wow must get much work done day u extra time grin,35,150
0,sometimes put wall around heartsnot safe getting hurt find care enough break wall amp get closer goodnoon,29,162
0,sweet may may go numberu meet carlos gauge patty interest,18,82
0,buying today need c meh,10,44
0,aight sorry take ten year shower whats plan,11,56
0,every mondaynxt week vl completing,6,41
0,might ax well im,5,23
0,chill another numberhrs could sleep pain surgical emergency see unfolds okay,22,112
0,yeah ill try scrounge something,7,38
0,crazy ar he married like gd looking guy frens like say he korean leonas fave dun thk aft thinking mayb prob ill go,33,159
0,somewhere fredericksburg,4,32
0,que pas un buen tiempo something like,9,47
0,ok stay night xavier sleeping bag im getting tired,18,82
0,doesnt need test,5,25
0,nothing much chillin home super bowl plan,9,51
1,freenumberday sexy st george day pic jordantxt pic number dont miss every wk saucy celebnumber pic c pocketbabecouk number poundnumberwk,26,154
0,bugis oso near wat,4,21
0,yo there class tmrw right,6,30
0,let ur heart ur compass ur mind ur map ur soul ur guide u never loose worldgnun sent via waynumbersmscom,25,121
0,goodnight sleep well da please take care pa please,9,53
0,baaaaabe miss youuuuu go teach class number,20,84
0,u ned convince tht possible witot hurting feeling main,16,81
0,good afternoon loverboy go day luck come way think sweetie send love across sea make smile happy,32,152
0,start sending blackberry torch nigeria find buyer melike numbera month tell dad buy bb anyone oh,26,131
0,ltgt percentageof pple marry lover becz hav gud undrstndng dat avoids problem sent dis number u u wil get gud news friday person like tomorrow best day life dont break chain break suffer send ltgt frnds ltgt min whn u read,63,327
0,yo dude guess got arrested day,10,49
0,shuhui say change number suntec steamboat u noe r u,13,65
0,dance river,6,29
0,yetunde im sorry moji seem busy able go shopping please find way get wanted u get please forgive reply free via yahoo messenger,42,207
0,hey really pretty late want go lesson first join im reaching tp mrt,24,114
1,hot live fantasy call number numberp per min ntt ltd po box number croydon crnumber numberwb numberk,19,101
0,bbq sat mine numberish ur welcome number come,11,49
0,dont know thing thats wrong everyso often panicks start goin bout bein good enough,20,106
0,alright im outhave good night,6,36
0,try making another butt,6,32
0,hope feeling great pls fill abiola,10,50
0,though shd go n fun bar town something sound ok,19,78
0,number go write msg number put dictionary mode numbercover screen hand numberpress ltgt numbergently remove ur hand interesting,24,141
1,bear pic nick tom pete dick fact type try gay chat photo upload call number numberpmin number stop text call number,27,151
1,number new mobile number must go txt nokia number collect todayfrom poundnumber numberoptout numbernumbergbpmtmsgnumber txtauction,22,153
0,finally ready fyi,4,23
0,auntie huai juan never pick phone,8,40
1,double min double txt numbernumber price linerental latest orange bluetooth mobile call mobileupdnumber latest offer number callnumberoptoutlfnumber,24,159
0,ya tel wats ur problem,5,25
0,dnt wnt tlk wid u,7,22
0,spend day waiting ideal path appear front u forget path made walking waiting goodnight,29,153
0,ok arm feeling weak cuz got shot go another time,18,72
0,please reserve ticket saturday eve chennai thirunelvali tirunelvali chennai sunday evei already see netno ticket availablei want book ticket tackle,32,203
0,storming msg wen u lift phne u say hello u knw wt real meaning hello name girl yes u knw dat girl margaret hello girlfrnd f grahmbell invnted telphone moralone numberget name person bt girlfrnd g n g h,79,324
0,thats ok popped ask bout something said youd around tonght wen girl come,23,115
0,e best number ur exam later,7,27
0,hope ur head doesnt hurt number much ploughing way pile ironing staying chinky tonight come round like,29,139
0,oh ki think wi nz player unsold,10,46
0,haha got fast lose weight thk muz go number month den got effect geelater go aust put bk e weight,24,115
0,wonder got online love gone net cafe get phone recharged friend net think boytoy,36,155
0,haha kidding papa need drug,6,35
0,thk shld b ya wana go number lesson haha go one whole stretch,17,82
0,oh ok,2,7
0,r still meeting number dinner tonight,7,36
0,thats cool gentleman treat dignity respect,14,73
0,shall start hear,5,24
0,wait number u lor need number feel bad lar,12,49
0,check got detailed message,10,48
0,registered sinco payee log icicibankcom enter urn ltgt confirm beware fraud share disclose urn anyone,27,155
0,decided people care stuff vote caring stuff loser,18,93
0,kaiez enjoy ur tuition gee thk e second option sound beta ill go yan jiu den msg u,18,99
0,cool fun practicing making baby,8,48
0,actually getting ready leave house,7,42
0,kkany special today,3,24
1,urgent important information onumber user today lucky day number find log onto fantastic surprise awaiting,26,163
0,got ta,7,30
0,ive got ten buck jay noncomittal,8,44
0,hungry,5,24
0,pls speak customer machan,6,34
0,somewhere beneath pale moon light someone think u dream come true goodnite amp sweet dream,25,144
1,dear uve invited xchat final attempt contact u txt chat number numberpmsgrcvdhgsuitenumbernumberlandsrowwnumberjnumberhl ldn number yr,22,143
0,wats ur opinion abt abt character,11,52
0,jay snickering tell x totally fucking chord speak,17,82
0,nofew hour beforewent hair cut,7,39
0,wonder co dun rem seeing silver car thk saw black one,18,80
0,lmao take pic send,9,35
0,speak feel word better silence gud mrng,14,78
0,shes currently scotland,7,41
0,work week,7,27
1,congratulation ur awarded either poundnumber cd gift voucher free entry number poundnumber weekly draw txt music number tncs number winnumberppmxnumberagenumber,25,150
0,lol great im getting hungry,6,32
0,yes saw message,6,33
0,ill mu like ltgt second,8,41
0,thing r good thanx got exam march ive done revision fran still boyf ive got ta interviw number exeter bit worriedx,24,126
0,tell make little spreadsheet track whose idea smoke determine smoke much entire month february ill come,32,166
1,sale arsenal dartboard good condition double treble,12,71
0,dont look back building coat dont want get sick hurry home wear coat gym,30,141
0,painful personal thought always try keep everybody happy time nobody recognises alone,22,122
0,thanks lovely wisheds rock,7,38
0,intrepid duo great time see soon,13,62
0,asked sen come chennai search job,10,47
0,dad went oredi,4,21
0,jus hope true missin co im really missin havent done anything feel guilty yet,22,115
0,wat late still early mah juz go number dinner lor aiya dunno,16,71
0,arm fine hows cardiff uni,6,33
0,fact leave think addie go back school tues wed,16,72
0,cool breeze bright sun fresh flower twittering bird waiting wish u goodmorning amp nice day,21,132
0,yagoing restaurant,3,26
0,ok askd u knw tht,10,38
1,free numberst week entry number textpod number chance number win numbergb ipod poundnumber cash every wk txt pod number tscs custcare number,26,140
0,ducking chinchilla,3,25
0,marriage function,6,27
0,look like u wil b getting headstart im leaving bout numbernumberish u r desperate company could head earlierwe goin meet rummer,32,159
0,dont give flying monkey wot think certainly dont mind friend mine,20,103
1,registered optin subscriber ur draw number poundnumber gift voucher entered receipt correct an number whats nonumber bbc chart,28,141
0,say thanksnumber,2,12
0,msg rajini come,5,25
0,ya taking ure practical lesson start june,12,62
0,thats good need drug,6,33
0,stupidits possible,3,23
0,decide faster co si going home liao,11,52
1,summer finally fancy chat flirt sexy single yr area get matched reply summer free number join optout txt stop helpnumber,29,159
0,u sleeping going take haha got spy wat online checking n replying mail lor,20,104
1,claire havin borin time alone u wan na cum numbernite chat number hope number c u luv claire xx callspoundnumberminmoremobsemspoboxnumberponumberwa,26,153
1,bought one ringtone getting text costing number pound offering tone etc,14,81
0,yalru lyfu astne chikku bt innu mundhe lyf ali halla ke bilo marriageprogram edhae lyf nt yet ovr chikkuali vargu lyfu meow meowd,25,144
0,kinda first one get twelve aah speak tomo,10,51
1,number urgent mobile numberxxxxxxxxx poundnumbernumber bonus caller prize numbernumbernumber numbernd attempt reach call number asap,25,152
0,ok good later come find c lucky told go earlier later pple take finish,24,111
0,wat make u thk ill fall actually thk im quite prone number fall lucky dad home ask come n fetch already,29,131
1,number guaranteed latest nokia phone numbergb ipod mpnumber player poundnumber prize txt wordcollect nonumber tcllc nyusa numberpmt msgrcvdnumber,25,158
0,wont touch permission,8,42
1,hi lucy hubby meetins day fri b alone hotel u fancy cumin pls leave msg numberday number lucy x callspoundnumberminmobsmorelkpoboxnumberhpnumberfl,28,160
0,number wonder world numberth numberth ur style numberth ur smile numberth ur personality numberrd ur nature numbernd ur sm numberst ur lovely friendship good morning dear,30,151
0,take small dose tablet fever,7,37
0,oh u must taken real valentine shopping first,11,61
0,sent email address incomm right,16,72
0,gon na blake night might able get little early,21,93
0,friendship game play word say doesnt start march end may tomorrow yesterday today e,30,141
0,nice waitshould texting right im gon na pay ticket ya know,15,85
0,im watching lotr w si dis aft u wan number meet number dinner nite,20,78
0,keeping away like,7,33
0,think far find check google map place dorm,19,90
0,trip ok quite tiring lor uni start today ok number co im taking module jus concentrating final yr project,30,147
0,always saying welp,6,33
0,im guy browsin compulsory,6,32
0,purity friendship two smiling reading forwarded messageits smiling seeing name gud evng musthu,24,149
0,add dont really care cant least get dude fuck hey money want,30,132
0,hello lover go new job happy think wake slave send teasing kiss across sea,33,154
0,told number gautham,6,31
0,tell need investigate anywhere,9,51
0,ok juz receive,4,18
0,cant believe said many thing morning really wanted say good morning love beautiful morning see library later,34,172
1,account credited number free text message activate txt word credit number tc,22,130
0,end might still vomit okay everything come,15,76
0,moneyas youmoney aint thinghow sha,14,78
0,everything weather keep extra warm cold nothing serious pls lot vitamin c,22,112
0,hey gal anyone u going e driving centre tmr,12,58
0,im always yahoo messenger send message ill get may send mobile mode sha ill get reply,34,158
0,im putting ready lttimegt,11,59
0,time n smile r two crucial thing life sometimes time make u forget smile sometimes someone smile make u forget time gud noon,29,154
1,sm ac jsco energy high u may know numberchannel numberday ur leadership skill r strong psychic reply an wquestion end reply end jsco,28,154
0,hostbased idp linux system,5,34
1,hot live fantasy call number numberp per min ntt ltd po box number croydon crnumber numberwb number national rate call,24,122
0,dawhats plan,5,26
0,ill ltgt ok,6,31
0,oh god im almost home,6,26
0,total video converter free download type google search,10,64
1,thanks vote sing along star karaoke mobile free link reply sing,24,121
0,sound like something someone testing would sayy,9,56
0,u love someone dont make love u much u love much dont want loved anyone except gud nit,33,148
0,peteis phone still jenny college leannewhat,16,90
0,oops sorry check dont mind picking tomo half eight station would ok,22,110
0,hey sweet wondering moment might come want send file someone wont go yahoo connection suck remember set page go download format disc could tell know way download big file download stuff directly internet help would great prey teasing kiss,95,458
0,hows champ leaving glasgow,6,36
0,kall bestcongrats,3,28
0,wonder youll get text,7,33
0,need come home give good lovin,11,51
1,brand new mobile music service live free music player arrive shortly install phone browse content top artist,28,157
0,shall ask one thing dont mistake,10,45
0,check wid corect speling ie sarcasm,6,37
1,urgent mobile awarded poundnumbernumber bonus caller prize numbernumbernumber numbernd attempt contact call numbernumbernumber boxnumberqu bt national rate,27,158
0,angry happen dear,8,39
0,thk u dun haf number hint e forum already lor co told ron n darren going number tell shuhui,23,96
0,yup ok thanx,3,15
0,hicts employee,5,29
0,pls pls find aunt nike,7,32
0,wow love sooo much know barely stand wonder day go well love think miss,37,152
0,screaming mean shouting,4,29
0,hey happen de alright,7,36
0,picked receipt something earlier,10,54
0,think chennai well settled,5,29
0,oh dang didnt mean send lol,11,47
0,unfortunately ive found pick sister airport evening dont think ill going try go one th,36,172
0,horrible bf v hungry,6,32
0,remember day,4,22
1,nokia numberi get win free auction take part send nokia number hgsuitenumbernumberlands rowwnumberjhl number,28,150
0,hows feel mr real valentine yo valentine even tho u hardly play,18,91
0,sound good finger make difficult type,10,53
0,midnight earliest,4,24
0,youre sure im trying make xavier smoke dont want smoke told smoke much,24,121
0,k come nordstrom youre done,7,36
0,u konw waht rael friendship im gving yuo exmpel jsut ese tihs msg evrey splleing tihs msg wrnog bt sitll yuo raed wihtuot ayn mitsake goodnight amp nice sleepsweet dream,39,212
0,press conference da,4,25
1,hello orange number month free access game news sport plus number free text number photo message reply yes term apply,26,156
0,completed degree use joining finance,10,59
0,good afternoon love job prospect missing lazy bleak hmmm happy filled love,35,155
0,shant disturb u anymore jia,6,37
0,bishan lar nearer need buy early co buy got ta park car,17,79
0,dont know oh,6,24
0,dude sux snake got old raiden got buff,11,50
0,say hi get as back south tampa preferably kegger,16,75
0,e msg jus u said thanks gift,10,41
0,u,2,8
0,ok dear call chechi,8,36
0,yeah tote u wan na,7,31
0,ok found dis pierre cardin one look normal cost number sale,15,73
0,good sleep rhythm person establish rhythm body learn use want know,26,127
0,wat r u,4,14
0,message truro hospital ext phone phone side,23,97
0,single line big meaning miss anything number ur best life dont miss ur best life anything gud nyt,22,123
0,got gas money chance gang want go grand nature adventure,19,92
0,dnt worryuse ice piece cloth packalso take number tablet,11,63
0,dude saw parked car sunroof popped sux,12,58
0,get ready put excellent sub face,10,46
0,tmrw im finishing number door,5,26
0,ltgt g saw day ago guy want sell wifi ltgt numberg ltgt thats blanked,29,143
0,late,8,29
0,whatever im pretty pissed,5,31
0,dont much image class,8,37
0,noi got rumour going buy apartment chennai,11,63
0,near kalainar tv officethenampet,4,33
1,ur cashbalance currently number pound maximize ur cashin send go number numberpmsg cc number hgsuitenumbernumberlands rowwnumberjnumberhl,22,145
1,sm auction brand new nokia number number auction today auction free number join take part txt nokia number hgsuitenumbernumberlands rowwnumberjnumberhl,28,149
0,si catching e show e afternoon im watching w c u wan number watch today tmr lor,25,104
0,sound gd haha wah u yan jiu fast liao,11,58
0,nosy guess idk reacting im freaked,14,62
0,remember hurt day satanic imposter meneed pay priceso itmay destiny keep going u said pray get mind get,38,184
0,make girl happy difficult make girl happy u need number friend number companion number lover number chef ltgt good listener ltgt organizer ltgt good boyfriend ltgt clean ltgt sympathetic ltgt athletic ltgt warm ltgt courageous ltgt determined ltgt true ltgt dependable ltgt intelligent ltgt psychologist ltgt pest exterminator ltgt psychiatrist ltgt healer ltgt stylist ltgt driver aaniye pudunga venaam,103,611
0,princess bet brothas chasing,12,61
0,shall book chez jules half eight thats ok,13,62
0,hhahhaahahah rofl wtf nig leonardo room something,11,64
0,yep dereks house see sunday ltnumber,9,47
0,cool let know kick around ltgt ill day,19,92
0,wondering would okay call uncle john let know thing nigeria r ltgt dollar numberyears sent know strain plan pay back every dime give every dime expect anything practical something like,69,338
0,charge transfer charge withdraw anyhow like,15,86
0,dont search love let love find u thats called falling love bcoz u dont force u fall u know smeone hold u bslvyl,32,159
0,number let go bill miller,7,30
0,love set soul fire spark flame big rawring flame xoxo,25,105
0,somewhr someone surely made number u god decided perfect time make u meet dat person till den enjoy ur crush,33,148
0,thats honeymoon outfit,5,30
0,help propose going back tomorrow,10,52
1,private number account statement show number unredeemed point call number identifier code number expires numbernumbernumber,20,136
0,never blame day ur life good day give u happiness bad day give u experience essential life god blessing good morning,28,152
0,pls confirm time collect cheque,8,43
1,registered subscriber yr draw number poundnumber gift voucher b entered receipt correct an next olympics txt an number,29,145
1,urgent mobile number awarded poundnumber prize guaranteed call number land line claim number valid numberhrs numberppm,23,143
0,daddy take good care,8,35
0,yeah probably still got ta check leo,9,47
0,kthen special,4,25
0,carlos taking sweet time usual let know patty donewant smoke ill tell haul as,27,127
0,ok pa nothing problem,4,25
0,heard job im going wildlife talk tonight u wantnumbercome thatnumberworzels wizzle whatever,26,142
0,god picked flower dippeditinadew lovingly touched itwhichturnedinto u gifted tomeandsaidthis friend numberu,19,128
0,came hostel,5,24
0,ok prob ill come lunch,8,43
0,jus telling u dat ill b leaving number shanghai numberst instead well haf time number meet cya,21,99
0,freezing home yet remember kiss mom morning love think missing yet,36,152
0,ready big day tomorrow,8,37
0,ill probably around mu lot,7,32
0,number,1,3
1,rtking pro video club need help emailaddr call number must number club credit redeemable enjoy,20,153
0,thnx dude u guy numbernite,6,28
0,sef dey laugh meanwhile hows darling anjie,10,55
0,mm food da,8,28
0,k make sense btw carlos difficult guy gon na smoke go pick second batch get gas,25,121
0,u download fring app,6,29
0,number oz guy kinda flaky one friend interested picking dollar ltgt worth tonight possible,22,115
0,friend u stay fb chat,9,39
0,fuck babe miss sooooo much wish sleep bed lonely go sleep dream love,37,154
0,living simple loving also simple laughing simple winning tooo simple simple difficult gud nte,24,148
1,u secret admirer looking number make contact ufind rreveal think ur specialcall number,24,132
0,ah well confuses thing doesnt,7,42
1,number free text msg text ok number well credit account,14,71
0,hi dear call urgnt dont know whats problem dont want work problem least tell wating reply,32,156
0,dear ok,6,25
1,selected stay number number top british hotel nothing holiday worth poundnumber claim call london number bx number swnumberss,27,146
0,yes princess want make happy,8,41
